vendor_name,contact_name,channel,contact_value,organization_type,lane_strength,service_scope,remarks
Anchor Pacific Logistics,Lena Zhou,WeChat,anchor_pacific_lena,同行,盐田至美西整柜周班稳定,Ocean FCL / destination handling / AMS filing,常做家具类普货，周班稳定，可接整柜和目的港拆派
Cascade Global Forwarding,Marcus Lin,Email,marcus.lin@cascade-gf.com,供应商,双语操作与报关衔接稳定,Ocean FCL / customs / delivery,适合常规家具买家整票交付，清关交接顺畅
HarborLink Shipping,Eva Chen,WhatsApp,+1-213-555-0188,供应商,美西快船和旺季保舱能力较强,Express ocean / urgent replenishment,适合时效敏感货，价格略高但放舱更稳
Orbit Blue Cargo,Kevin Wu,WeChat,orbitblue_kevin,同行,LAX 拖车与尾程派送资源灵活,Drayage / LAX warehouse delivery,适合需要拆柜后派送到仓的客户
Pacific Crest Freight,Sophia Tan,Email,sophia.tan@pacificcrestfreight.com,供应商,可做门到门整票交付,Ocean FCL / POD trucking / appointment delivery,对海外仓预约和末端交仓比较熟
Golden Bay NVOCC,Ryan Qiu,WeChat,goldenbay_ryan,同行,拼箱整合和临时甩柜协调经验多,Space coordination / roll-over handling,适合旺季二轮询价和临时补位
